{
  "$schema": "https://json-schema.org/draft/2020-12/schema",
  "title": "Crop profile: imagery",
  "type": "object",
  "properties": {
    "requirements": {
      "type": "array",
      "items": {
        "type": "object",
        "properties": {
          "capability": {
            "type": "string",
            "enum": [
              "row-detection",
              "row-spacing",
              "planting-positions",
              "crop-vs-weed-by-position",
              "vegetation-segmentation",
              "between-row-weed-cover",
              "weed-pressure-grade",
              "hotspots",
              "weed-isolation",
              "weed-measurement",
              "species-priors",
              "stand-count",
              "growth-stage-from-imagery",
              "stage-estimate",
              "canopy-height"
            ]
          },
          "maxGsdCm": {
            "type": "number",
            "exclusiveMinimum": 0
          },
          "recommendedGsdCm": {
            "type": "number",
            "exclusiveMinimum": 0
          },
          "stages": {
            "type": "array",
            "items": {
              "type": "string"
            }
          },
          "basis": {
            "type": "string"
          },
          "evidence": {
            "type": "object",
            "properties": {
              "sources": {
                "type": "array",
                "items": {
                  "type": "string",
                  "minLength": 1
                }
              },
              "strength": {
                "type": "string",
                "enum": [
                  "strong",
                  "moderate",
                  "weak",
                  "snippet",
                  "estimate",
                  "none"
                ]
              },
              "geography": {
                "type": "string"
              },
              "stages": {
                "type": "array",
                "items": {
                  "type": "string"
                }
              },
              "notes": {
                "type": "string"
              },
              "disagreement": {
                "type": "string"
              }
            },
            "required": [
              "sources",
              "strength"
            ]
          }
        },
        "required": [
          "capability",
          "maxGsdCm",
          "basis",
          "evidence"
        ]
      }
    },
    "flight": {
      "type": "array",
      "items": {
        "type": "object",
        "properties": {
          "id": {
            "type": "string",
            "pattern": "^[a-z0-9][a-z0-9_.-]*$"
          },
          "parameter": {
            "type": "string"
          },
          "guidance": {
            "type": "string"
          },
          "evidence": {
            "type": "object",
            "properties": {
              "sources": {
                "type": "array",
                "items": {
                  "type": "string",
                  "minLength": 1
                }
              },
              "strength": {
                "type": "string",
                "enum": [
                  "strong",
                  "moderate",
                  "weak",
                  "snippet",
                  "estimate",
                  "none"
                ]
              },
              "geography": {
                "type": "string"
              },
              "stages": {
                "type": "array",
                "items": {
                  "type": "string"
                }
              },
              "notes": {
                "type": "string"
              },
              "disagreement": {
                "type": "string"
              }
            },
            "required": [
              "sources",
              "strength"
            ]
          }
        },
        "required": [
          "id",
          "parameter",
          "guidance",
          "evidence"
        ]
      }
    },
    "cameras": {
      "type": "array",
      "items": {
        "type": "object",
        "properties": {
          "id": {
            "type": "string",
            "pattern": "^[a-z0-9][a-z0-9_.-]*$"
          },
          "name": {
            "type": "string"
          },
          "gsdCmPerMetreAltitude": {
            "type": "number",
            "exclusiveMinimum": 0
          },
          "evidence": {
            "type": "object",
            "properties": {
              "sources": {
                "type": "array",
                "items": {
                  "type": "string",
                  "minLength": 1
                }
              },
              "strength": {
                "type": "string",
                "enum": [
                  "strong",
                  "moderate",
                  "weak",
                  "snippet",
                  "estimate",
                  "none"
                ]
              },
              "geography": {
                "type": "string"
              },
              "stages": {
                "type": "array",
                "items": {
                  "type": "string"
                }
              },
              "notes": {
                "type": "string"
              },
              "disagreement": {
                "type": "string"
              }
            },
            "required": [
              "sources",
              "strength"
            ]
          }
        },
        "required": [
          "id",
          "name",
          "gsdCmPerMetreAltitude",
          "evidence"
        ]
      }
    },
    "orthoVsFrames": {
      "type": "array",
      "items": {
        "type": "object",
        "properties": {
          "id": {
            "type": "string",
            "pattern": "^[a-z0-9][a-z0-9_.-]*$"
          },
          "topic": {
            "type": "string"
          },
          "guidance": {
            "type": "string"
          },
          "evidence": {
            "type": "object",
            "properties": {
              "sources": {
                "type": "array",
                "items": {
                  "type": "string",
                  "minLength": 1
                }
              },
              "strength": {
                "type": "string",
                "enum": [
                  "strong",
                  "moderate",
                  "weak",
                  "snippet",
                  "estimate",
                  "none"
                ]
              },
              "geography": {
                "type": "string"
              },
              "stages": {
                "type": "array",
                "items": {
                  "type": "string"
                }
              },
              "notes": {
                "type": "string"
              },
              "disagreement": {
                "type": "string"
              }
            },
            "required": [
              "sources",
              "strength"
            ]
          }
        },
        "required": [
          "id",
          "topic",
          "guidance",
          "evidence"
        ]
      }
    },
    "qualityChecks": {
      "type": "array",
      "items": {
        "type": "object",
        "properties": {
          "id": {
            "type": "string",
            "pattern": "^[a-z0-9][a-z0-9_.-]*$"
          },
          "check": {
            "type": "string"
          },
          "computedFrom": {
            "type": "string"
          },
          "threshold": {
            "type": "string"
          },
          "code": {
            "type": "string"
          },
          "evidence": {
            "type": "object",
            "properties": {
              "sources": {
                "type": "array",
                "items": {
                  "type": "string",
                  "minLength": 1
                }
              },
              "strength": {
                "type": "string",
                "enum": [
                  "strong",
                  "moderate",
                  "weak",
                  "snippet",
                  "estimate",
                  "none"
                ]
              },
              "geography": {
                "type": "string"
              },
              "stages": {
                "type": "array",
                "items": {
                  "type": "string"
                }
              },
              "notes": {
                "type": "string"
              },
              "disagreement": {
                "type": "string"
              }
            },
            "required": [
              "sources",
              "strength"
            ]
          }
        },
        "required": [
          "id",
          "check",
          "computedFrom",
          "evidence"
        ]
      }
    },
    "gaps": {
      "type": "array",
      "items": {
        "type": "string"
      }
    }
  },
  "required": [
    "requirements",
    "flight",
    "cameras",
    "orthoVsFrames",
    "qualityChecks",
    "gaps"
  ]
}
